{
  "$schema": "../schemas/test-catalog-v1.schema.json",
  "defaultQuickSuiteIds": [
    "format-check",
    "lint",
    "frontend-vitest",
    "frontend-build",
    "openapi-check",
    "python-backend",
    "rust-check",
    "version-check"
  ],
  "diagnostics": [],
  "schemaVersion": 1,
  "sourceSnapshot": {
    "headCommit": "28245bb15972",
    "worktreeHash": "0c5ea0ec4569412e23ddc96494d8c666a398810cd9528887fa68724c49b2eacb"
  },
  "suites": [
    {
      "expectedBehaviors": ["Desktop E2E passes without login or cloud synchronization."],
      "id": "desktop-e2e",
      "kind": "e2e",
      "label": "Desktop browser E2E",
      "prerequisites": [
        {
          "check": "npm.cmd --version",
          "kind": "runtime",
          "name": "Node.js and npm",
          "required": true
        },
        {
          "check": "PYTHON_EXECUTABLE points to a file, or .venv-test/Scripts/python.exe / .venv-test/bin/python exists",
          "kind": "runtime",
          "name": "Fail-closed locked test Python resolver",
          "required": true
        }
      ],
      "purpose": "Runs the real desktop-mode browser workflow with isolated local data.",
      "runner": "playwright",
      "sourceFiles": ["Office/goose.yaml", "Office/test/README.md"],
      "status": "conditional",
      "trigger": {
        "changeTypes": ["e2e", "desktop"],
        "componentIds": [],
        "includeOneHopDependents": true,
        "paths": [
          "src/**",
          "backend/**",
          "Office/test/e2e/**",
          "scripts/e2e-launcher.mjs",
          "scripts/python-executable.mjs"
        ]
      },
      "validationCommandId": "desktop-e2e"
    },
    {
      "expectedBehaviors": ["Prettier reports no formatting drift."],
      "id": "format-check",
      "kind": "format",
      "label": "Prettier format check",
      "prerequisites": [
        {
          "check": "npm.cmd --version",
          "kind": "runtime",
          "name": "Node.js and npm",
          "required": true
        }
      ],
      "purpose": "Checks tracked source and governance formatting.",
      "runner": "npm",
      "sourceFiles": ["Office/goose.yaml", "Office/test/README.md"],
      "status": "confirmed-command",
      "trigger": {
        "changeTypes": ["format"],
        "componentIds": [],
        "includeOneHopDependents": true,
        "paths": ["src/**", "backend/**", "Office/**", "*.json", "*.ts", "*.tsx"]
      },
      "validationCommandId": "format-check"
    },
    {
      "expectedBehaviors": ["TypeScript and Vite production build pass."],
      "id": "frontend-build",
      "kind": "build",
      "label": "Frontend production build",
      "prerequisites": [
        {
          "check": "npm.cmd --version",
          "kind": "runtime",
          "name": "Node.js and npm",
          "required": true
        }
      ],
      "purpose": "Compiles TypeScript and produces the browser bundle.",
      "runner": "npm",
      "sourceFiles": ["Office/goose.yaml", "Office/test/README.md"],
      "status": "confirmed-command",
      "trigger": {
        "changeTypes": ["build"],
        "componentIds": [],
        "includeOneHopDependents": true,
        "paths": ["src/**", "vite.config.ts", "tsconfig*.json", "package.json"]
      },
      "validationCommandId": "frontend-build"
    },
    {
      "expectedBehaviors": ["Vitest unit and integration suites pass."],
      "id": "frontend-vitest",
      "kind": "test",
      "label": "Vitest unit and integration",
      "prerequisites": [
        {
          "check": "npm.cmd --version",
          "kind": "runtime",
          "name": "Node.js and npm",
          "required": true
        }
      ],
      "purpose": "Runs deterministic frontend unit and integration coverage.",
      "runner": "vitest",
      "sourceFiles": ["Office/goose.yaml", "Office/test/README.md"],
      "status": "confirmed-command",
      "trigger": {
        "changeTypes": ["test"],
        "componentIds": [],
        "includeOneHopDependents": true,
        "paths": ["src/**", "Office/test/unit/**", "Office/test/integration/**"]
      },
      "validationCommandId": "frontend-vitest"
    },
    {
      "expectedBehaviors": ["ESLint reports no errors."],
      "id": "lint",
      "kind": "lint",
      "label": "ESLint source checks",
      "prerequisites": [
        {
          "check": "npm.cmd --version",
          "kind": "runtime",
          "name": "Node.js and npm",
          "required": true
        }
      ],
      "purpose": "Checks TypeScript and React lint contracts.",
      "runner": "npm",
      "sourceFiles": ["Office/goose.yaml", "Office/test/README.md"],
      "status": "confirmed-command",
      "trigger": {
        "changeTypes": ["lint"],
        "componentIds": [],
        "includeOneHopDependents": true,
        "paths": ["src/**", "Office/test/**/*.ts", "Office/test/**/*.tsx", "eslint.config.js"]
      },
      "validationCommandId": "lint"
    },
    {
      "expectedBehaviors": ["Migration and contract tests pass only against disposable MySQL."],
      "id": "mysql-contract",
      "kind": "integration",
      "label": "Disposable MySQL contract",
      "prerequisites": [
        {
          "check": "docker info",
          "kind": "runtime",
          "name": "Docker Engine",
          "required": true
        },
        {
          "check": "PYTHON_EXECUTABLE points to a file, or .venv-test/Scripts/python.exe / .venv-test/bin/python exists",
          "kind": "runtime",
          "name": "Fail-closed locked test Python resolver",
          "required": true
        },
        {
          "check": "The scripts use only the disposable calendar_test database and remove containers and volumes",
          "kind": "data-boundary",
          "name": "Disposable MySQL test data",
          "required": true
        }
      ],
      "purpose": "Starts disposable MySQL, migrates, runs its contract, and removes the volume.",
      "runner": "powershell",
      "sourceFiles": ["Office/goose.yaml", "Office/test/README.md"],
      "status": "conditional",
      "trigger": {
        "changeTypes": ["database", "integration"],
        "componentIds": [],
        "includeOneHopDependents": true,
        "paths": [
          "backend/calendar/migrations/**",
          "Office/test/backend/test_mysql_contract.py",
          "scripts/test-mysql.ps1",
          "scripts/python-executable.mjs"
        ]
      },
      "validationCommandId": "mysql-contract"
    },
    {
      "expectedBehaviors": ["No high or critical npm vulnerabilities remain."],
      "id": "npm-audit-full",
      "kind": "security",
      "label": "Full npm dependency audit",
      "prerequisites": [
        {
          "check": "npm.cmd --version",
          "kind": "runtime",
          "name": "Node.js and npm",
          "required": true
        }
      ],
      "purpose": "Runs the full npm high-severity audit as a release gate.",
      "runner": "npm",
      "sourceFiles": ["Office/goose.yaml", "Office/test/README.md"],
      "status": "release",
      "trigger": {
        "changeTypes": ["release", "dependencies"],
        "componentIds": [],
        "includeOneHopDependents": true,
        "paths": ["package.json", "package-lock.json"]
      },
      "validationCommandId": "npm-audit-full"
    },
    {
      "expectedBehaviors": ["Production dependencies have no high or critical findings."],
      "id": "npm-audit-production",
      "kind": "security",
      "label": "Production npm dependency audit",
      "prerequisites": [
        {
          "check": "npm.cmd --version",
          "kind": "runtime",
          "name": "Node.js and npm",
          "required": true
        }
      ],
      "purpose": "Audits production npm dependencies as a release gate.",
      "runner": "npm",
      "sourceFiles": ["Office/goose.yaml", "Office/test/README.md"],
      "status": "release",
      "trigger": {
        "changeTypes": ["release", "dependencies"],
        "componentIds": [],
        "includeOneHopDependents": true,
        "paths": ["package.json", "package-lock.json"]
      },
      "validationCommandId": "npm-audit-production"
    },
    {
      "expectedBehaviors": ["Generated OpenAPI is byte-compatible with the accepted snapshot."],
      "id": "openapi-check",
      "kind": "contract",
      "label": "OpenAPI snapshot check",
      "prerequisites": [
        {
          "check": "PYTHON_EXECUTABLE points to a file, or .venv-test/Scripts/python.exe / .venv-test/bin/python exists",
          "kind": "runtime",
          "name": "Fail-closed locked test Python resolver",
          "required": true
        }
      ],
      "purpose": "Confirms backend API behavior matches the accepted OpenAPI snapshot.",
      "runner": "python",
      "sourceFiles": ["Office/goose.yaml", "Office/test/README.md"],
      "status": "confirmed-command",
      "trigger": {
        "changeTypes": ["contract"],
        "componentIds": [],
        "includeOneHopDependents": true,
        "paths": [
          "backend/**",
          "openapi/calendar-app.openapi.json",
          "scripts/export-openapi.py",
          "scripts/python-executable.mjs",
          "scripts/run-python.mjs"
        ]
      },
      "validationCommandId": "openapi-check"
    },
    {
      "expectedBehaviors": ["Desktop Python lock has no known release-blocking vulnerability."],
      "id": "python-audit-desktop",
      "kind": "security",
      "label": "Desktop Python dependency audit",
      "prerequisites": [
        {
          "check": "uvx --version",
          "kind": "runtime",
          "name": "uvx isolated tool runner",
          "required": true
        }
      ],
      "purpose": "Audits the locked desktop Python dependencies during release validation.",
      "runner": "uvx",
      "sourceFiles": ["Office/goose.yaml", "Office/test/README.md"],
      "status": "release",
      "trigger": {
        "changeTypes": ["release", "dependencies"],